{
  "schema": "jero-ai.review-result-artifact/v2",
  "capability": "review.native_result_artifact",
  "path": "/tmp/claude-1000/-home-gentleman-work-jero-ai/7629c2de-8b8b-4005-b117-ab45c0869f70/scratchpad/rart-capture/.git/jero-ai/review-transactions/v2/review-ceeb2b862bd39709/reviewer-results/00-review-reliability.json",
  "sha256": "sha256:c8b2d0ce70f22ff924447fe591dab4b4008e0b6cd7d4ac884439eaf6e47bd26e",
  "lineage_id": "review-ceeb2b862bd39709",
  "target_identity": "sha256:ceeb2b862bd39709a0c1d2642ba89711127de7e859d6c008bf1add73e4dc783e",
  "lens": "review-reliability",
  "selected_order": 0,
  "subject_hash": "sha256:6952f7ea0b589d882201943449b3f4ab9505551ad306460ee7bebc6b4671ae1e",
  "admission_decision": "completed"
}
